{
  "schema_version": 1,
  "manifest_id": "home_kitchen-101-40126e7195e5",
  "recipe_id": "home_kitchen",
  "recipe_version": "1.0.0",
  "registry_id": "living_room_shadow",
  "registry_version": "1.3.0",
  "seed": 101,
  "generation_hash": "40126e7195e5ad7d1062249afb46c324b13fedd277e4c68c9994b5d4b569cc54",
  "room": {
    "name": "厨房",
    "dimensions_m": {
      "width": 7.0,
      "depth": 6.0,
      "height": 3.0
    },
    "bounds": {
      "min": [
        -2.9,
        0.0,
        -2.4
      ],
      "max": [
        2.9,
        0.0,
        2.4
      ]
    },
    "floor": {
      "thickness_m": 0.1,
      "material_key": "warm_kitchen_floor"
    },
    "walls": [
      {
        "wall_id": "back",
        "thickness_m": 0.2,
        "height_m": 3.0,
        "material_key": "warm_plaster"
      },
      {
        "wall_id": "left",
        "thickness_m": 0.2,
        "height_m": 3.0,
        "material_key": "warm_plaster"
      },
      {
        "wall_id": "right",
        "thickness_m": 0.2,
        "height_m": 3.0,
        "material_key": "warm_plaster"
      }
    ],
    "openings": [
      {
        "opening_id": "door_to_living",
        "type": "door",
        "wall_id": "right",
        "position": [
          3.5,
          1.1,
          0.0
        ],
        "size": [
          1.25,
          2.2
        ]
      }
    ]
  },
  "placements": [
    {
      "semantic_id": "kitchen_fridge",
      "asset_id": "kitchen_fridge",
      "display_name": "冰箱",
      "position": [
        -2.4,
        0.95,
        -2.5
      ],
      "rotation_deg": [
        0,
        0,
        0
      ],
      "interaction_point": [
        -2.4,
        0,
        -1.65
      ],
      "description": "装着日常食材和饮料的冰箱。",
      "needs_proximity": true,
      "affordances": [
        "open",
        "take_food",
        "store_food",
        "inspect"
      ],
      "effects": {},
      "initial_state": "关闭",
      "properties": {
        "food_count": 6
      },
      "consumable": false
    },
    {
      "semantic_id": "kitchen_sink",
      "asset_id": "kitchen_sink_counter",
      "display_name": "水槽",
      "position": [
        -0.85,
        0.45,
        -2.55
      ],
      "rotation_deg": [
        0,
        0,
        0
      ],
      "interaction_point": [
        -0.85,
        0,
        -1.65
      ],
      "description": "可以清洗餐具和接水的料理台。",
      "needs_proximity": true,
      "affordances": [
        "wash",
        "fill_water",
        "inspect"
      ],
      "effects": {},
      "initial_state": "干净",
      "properties": {
        "water_running": false
      },
      "consumable": false
    },
    {
      "semantic_id": "kitchen_oven",
      "asset_id": "kitchen_oven",
      "display_name": "烤箱",
      "position": [
        0.55,
        0.45,
        -2.52
      ],
      "rotation_deg": [
        0,
        0,
        0
      ],
      "interaction_point": [
        0.55,
        0,
        -1.65
      ],
      "description": "可以烘烤简单食物的小烤箱。",
      "needs_proximity": true,
      "affordances": [
        "turn_on",
        "turn_off",
        "cook",
        "inspect"
      ],
      "effects": {},
      "initial_state": "关闭",
      "properties": {
        "temperature_c": 24
      },
      "consumable": false
    },
    {
      "semantic_id": "kitchen_table",
      "asset_id": "kitchen_table",
      "display_name": "餐桌",
      "position": [
        0.0,
        0.4,
        0.35
      ],
      "rotation_deg": [
        0,
        0,
        0
      ],
      "interaction_point": [
        0.0,
        0,
        1.35
      ],
      "description": "适合两个人一起吃饭的木质餐桌。",
      "needs_proximity": true,
      "affordances": [
        "place_item",
        "eat",
        "inspect"
      ],
      "effects": {},
      "initial_state": "收拾整齐",
      "properties": {},
      "consumable": false
    },
    {
      "semantic_id": "kitchen_chair_left",
      "asset_id": "kitchen_chair",
      "display_name": "左侧餐椅",
      "position": [
        -1.25,
        0.5,
        0.35
      ],
      "rotation_deg": [
        0,
        90,
        0
      ],
      "interaction_point": [
        -1.25,
        0,
        1.0
      ],
      "description": "",
      "needs_proximity": true,
      "affordances": [
        "sit",
        "inspect"
      ],
      "effects": {
        "energy": 4
      },
      "initial_state": "空着",
      "properties": {},
      "consumable": false
    },
    {
      "semantic_id": "kitchen_chair_right",
      "asset_id": "kitchen_chair",
      "display_name": "右侧餐椅",
      "position": [
        1.25,
        0.5,
        0.35
      ],
      "rotation_deg": [
        0,
        -90,
        0
      ],
      "interaction_point": [
        1.25,
        0,
        1.0
      ],
      "description": "",
      "needs_proximity": true,
      "affordances": [
        "sit",
        "inspect"
      ],
      "effects": {
        "energy": 4
      },
      "initial_state": "空着",
      "properties": {},
      "consumable": false
    },
    {
      "semantic_id": "kitchen_plant",
      "asset_id": "plant_potted",
      "display_name": "厨房香草",
      "position": [
        2.35,
        0.55,
        1.75
      ],
      "rotation_deg": [
        0,
        0,
        0
      ],
      "interaction_point": [
        1.75,
        0,
        1.75
      ],
      "description": "",
      "needs_proximity": true,
      "affordances": [
        "water",
        "prune",
        "look_at"
      ],
      "effects": {},
      "initial_state": "状态良好",
      "properties": {
        "moisture": 70,
        "health": 90
      },
      "consumable": false
    },
    {
      "semantic_id": "kitchen_cup",
      "asset_id": "milk_tea_cup",
      "display_name": "餐桌上的饮料",
      "position": [
        0.45,
        0.95,
        0.25
      ],
      "rotation_deg": [
        0,
        -12,
        0
      ],
      "interaction_point": [
        0.45,
        0,
        1.25
      ],
      "description": "放在餐桌上的一杯饮料，可以被拿起、放下或投掷。",
      "needs_proximity": true,
      "affordances": [
        "drink",
        "pick_up",
        "put_down",
        "throw"
      ],
      "effects": {
        "hunger": 8,
        "fun": 5
      },
      "initial_state": "放在餐桌上",
      "properties": {
        "volume_percent": 100
      },
      "consumable": true
    },
    {
      "semantic_id": "kitchen_lamp",
      "asset_id": "standing_lamp",
      "display_name": "厨房暖灯",
      "position": [
        -2.35,
        0.86,
        1.8
      ],
      "rotation_deg": [
        0,
        0,
        0
      ],
      "interaction_point": [
        -1.8,
        0,
        1.8
      ],
      "description": "",
      "needs_proximity": true,
      "affordances": [
        "turn_on",
        "turn_off",
        "inspect"
      ],
      "effects": {},
      "initial_state": "暖光已开启",
      "properties": {},
      "consumable": false
    }
  ],
  "audit": {
    "compiler_version": "1.1.0",
    "warnings": []
  }
}
