{
  "schema_version": 1,
  "manifest_id": "home_bedroom-202-629337305f47",
  "recipe_id": "home_bedroom",
  "recipe_version": "1.0.0",
  "registry_id": "living_room_shadow",
  "registry_version": "1.3.0",
  "seed": 202,
  "generation_hash": "629337305f476d1da164ef31eb701fb8ec6985f1b87ac79e44ec1007bd352667",
  "room": {
    "name": "卧室",
    "dimensions_m": {
      "width": 7.5,
      "depth": 7.5,
      "height": 3.0
    },
    "bounds": {
      "min": [
        -3.2,
        0.0,
        -3.2
      ],
      "max": [
        3.2,
        0.0,
        3.2
      ]
    },
    "floor": {
      "thickness_m": 0.1,
      "material_key": "warm_bedroom_floor"
    },
    "walls": [
      {
        "wall_id": "back",
        "thickness_m": 0.2,
        "height_m": 3.0,
        "material_key": "warm_plaster"
      },
      {
        "wall_id": "left",
        "thickness_m": 0.2,
        "height_m": 3.0,
        "material_key": "warm_plaster"
      },
      {
        "wall_id": "right",
        "thickness_m": 0.2,
        "height_m": 3.0,
        "material_key": "warm_plaster"
      }
    ],
    "openings": [
      {
        "opening_id": "door_to_living",
        "type": "door",
        "wall_id": "left",
        "position": [
          -3.75,
          1.1,
          0.0
        ],
        "size": [
          1.25,
          2.2
        ]
      },
      {
        "opening_id": "door_to_study",
        "type": "door",
        "wall_id": "right",
        "position": [
          3.75,
          1.1,
          1.55
        ],
        "size": [
          1.25,
          2.2
        ]
      }
    ]
  },
  "placements": [
    {
      "semantic_id": "bed",
      "asset_id": "bedroom_bed",
      "display_name": "双人软床",
      "position": [
        -1.25,
        0.4,
        1.75
      ],
      "rotation_deg": [
        0,
        0,
        0
      ],
      "interaction_point": [
        -1.25,
        0,
        0.95
      ],
      "description": "铺着暖色床品和靠枕的舒适双人床。",
      "needs_proximity": true,
      "affordances": [
        "sit",
        "lie_down"
      ],
      "effects": {
        "energy": 25
      },
      "initial_state": "整理好了",
      "properties": {},
      "consumable": false
    },
    {
      "semantic_id": "bedroom_table",
      "asset_id": "coffee_table_current",
      "display_name": "卧室矮桌",
      "position": [
        1.25,
        0.25,
        0.65
      ],
      "rotation_deg": [
        0,
        90,
        0
      ],
      "interaction_point": [
        1.25,
        0,
        -0.15
      ],
      "description": "",
      "needs_proximity": true,
      "affordances": [
        "inspect",
        "place_item"
      ],
      "effects": {},
      "initial_state": "收拾整齐",
      "properties": {},
      "consumable": false
    },
    {
      "semantic_id": "bedroom_chair",
      "asset_id": "reading_armchair",
      "display_name": "阅读椅",
      "position": [
        0.9,
        0.5,
        2.6
      ],
      "rotation_deg": [
        0,
        -15,
        0
      ],
      "interaction_point": [
        0.9,
        0,
        1.8
      ],
      "description": "",
      "needs_proximity": true,
      "affordances": [
        "sit",
        "inspect"
      ],
      "effects": {
        "energy": 8,
        "fun": 4
      },
      "initial_state": "空着",
      "properties": {},
      "consumable": false
    },
    {
      "semantic_id": "bedroom_bookshelf",
      "asset_id": "bookshelf_current",
      "display_name": "卧室书架",
      "position": [
        2.6,
        1.1,
        -2.8
      ],
      "rotation_deg": [
        0,
        0,
        0
      ],
      "interaction_point": [
        2.2,
        0,
        -2.1
      ],
      "description": "",
      "needs_proximity": true,
      "affordances": [
        "browse",
        "take_book",
        "put_book_back"
      ],
      "effects": {},
      "initial_state": "摆着睡前读物",
      "properties": {},
      "consumable": false
    },
    {
      "semantic_id": "bedroom_lamp",
      "asset_id": "standing_lamp",
      "display_name": "床边暖灯",
      "position": [
        -2.65,
        0.86,
        0.2
      ],
      "rotation_deg": [
        0,
        0,
        0
      ],
      "interaction_point": [
        -2.15,
        0,
        0.2
      ],
      "description": "",
      "needs_proximity": true,
      "affordances": [
        "turn_on",
        "turn_off",
        "inspect"
      ],
      "effects": {},
      "initial_state": "柔和夜灯",
      "properties": {},
      "consumable": false
    },
    {
      "semantic_id": "bedroom_rug",
      "asset_id": "conversation_rug",
      "display_name": "卧室地毯",
      "position": [
        0.0,
        0.04,
        0.7
      ],
      "rotation_deg": [
        0,
        0,
        0
      ],
      "interaction_point": [
        0.0,
        0,
        0.7
      ],
      "description": "",
      "needs_proximity": false,
      "affordances": [],
      "effects": {},
      "initial_state": "铺得平整",
      "properties": {},
      "consumable": false
    },
    {
      "semantic_id": "bedroom_book",
      "asset_id": "book_current",
      "display_name": "睡前读物",
      "position": [
        1.25,
        0.55,
        0.65
      ],
      "rotation_deg": [
        0,
        20,
        0
      ],
      "interaction_point": [
        1.25,
        0.0,
        -0.15
      ],
      "description": "",
      "needs_proximity": true,
      "affordances": [
        "read",
        "pick_up",
        "put_down"
      ],
      "effects": {
        "fun": 12
      },
      "initial_state": "放在矮桌上",
      "properties": {},
      "consumable": false
    }
  ],
  "audit": {
    "compiler_version": "1.1.0",
    "warnings": []
  }
}
